{
  "$schema": "../setting-research.schema.json",
  "schema_version": "1.0",
  "record_id": "system.memory-large-system-cache-client",
  "tweak_id": "system.memory-large-system-cache-client",
  "record_status": "validated",
  "summary": "Validated legacy LargeSystemCache reset. Win25H2Clean reversible probe confirmed LargeSystemCache stayed at 0 under Memory Management and restored the baseline.",
  "setting": {
    "name": "Large System Cache",
    "category": "System",
    "area": "Memory Management / Cache Mode",
    "scope": "device",
    "casual_explanation": "Windows historically had a switch between favoring normal applications and favoring a larger system cache. Most normal users should leave this alone on modern systems.",
    "why_people_change_it": "People only change it when they are undoing very old file-server or memory-cache tuning and want to restore an application-focused client baseline.",
    "tradeoffs_overview": "The app only writes the legacy client value 0. Microsoft still marks the property obsolete, so this should be read as a reset-to-client-baseline action, not as a modern performance recommendation.",
    "professional_notes": "Microsoft's Win32_OperatingSystem class still describes LargeSystemCache with 0 meaning 'Optimize for Applications' and 1 meaning 'Optimize for System Performance', but the same property is marked obsolete and not supported. The current Memory Limits page only mentions that old Windows XP and Windows Server 2003 limits changed when the LargeSystemCache registry key was set. That means this is not a modern recommended tuning surface, but the current app behavior is still exact and narrow: it writes the legacy client reset value LargeSystemCache = 0, and the Win25H2Clean reversible probe showed the value was already 0 and restored cleanly.",
    "targets": [
      {
        "target_id": "large-system-cache",
        "location_kind": "registry",
        "path": "HKLM\\SYSTEM\\CurrentControlSet\\Control\\Session Manager\\Memory Management",
        "value_name": "LargeSystemCache",
        "value_type": "REG_DWORD",
        "allowed_values": [
          {
            "state_kind": "value",
            "value": 0,
            "label": "Optimize for applications",
            "meaning": "The historical semantics exposed by Win32_OperatingSystem say memory is optimized for applications.",
            "evidence_ids": [
              "ms-win32-operatingsystem-largesystemcache",
              "app-system-registry-provider"
            ]
          },
          {
            "state_kind": "value",
            "value": 1,
            "label": "Optimize for system performance",
            "meaning": "The historical semantics exposed by Win32_OperatingSystem say memory is optimized for system performance.",
            "evidence_ids": [
              "ms-win32-operatingsystem-largesystemcache",
              "ms-memory-limits-large-system-cache"
            ]
          }
        ]
      }
    ]
  },
  "app_current_implementation": {
    "status": "matches-research",
    "provider_source": "app/Services/TweakProviders/ResearchAppSurfaceTweakProvider.cs",
    "notes": "The current app research-surface manifest defaults this card to LargeSystemCache = 0, preserving the documented client-cache baseline while keeping the record_id bound to the surfaced card.",
    "writes": [
      {
        "target_id": "large-system-cache",
        "path": "HKLM\\SYSTEM\\CurrentControlSet\\Control\\Session Manager\\Memory Management",
        "value_name": "LargeSystemCache",
        "value_type": "REG_DWORD",
        "state_kind": "value",
        "value": 0,
        "notes": "Observed app value under review."
      }
    ]
  },
  "windows_defaults": [
    {
      "label": "Conservative publication baseline",
      "applies_to": "Modern systems where this dataset does not yet publish LargeSystemCache as a supported tuning surface",
      "states": [
        {
          "target_id": "large-system-cache",
          "state_kind": "unknown",
          "value": null,
          "rationale": "Keep the legacy client value 0 used by the current app and confirmed by the VM probe."
        }
      ],
      "notes": "This remains a legacy surface, but the current app action is an exact reset to the client baseline.",
      "evidence_ids": [
        "ms-win32-operatingsystem-largesystemcache",
        "ms-memory-limits-large-system-cache"
      ]
    }
  ],
  "recommended_profiles": [
    {
      "profile_id": "hold-for-research",
      "label": "Hold for research",
      "intended_for": [
        "Systems undoing an old server-style cache tweak",
        "Research tracking only"
      ],
      "avoid_for": [
        "Published validated presets",
        "General users"
      ],
      "states": [
        {
          "target_id": "large-system-cache",
          "state_kind": "unknown",
          "value": null,
          "rationale": "Do not treat this as a modern tuning control; only use it as a legacy reset reference."
        }
      ],
      "good_when": "You want to document the setting without overstating confidence.",
      "bad_when": "You want the app to actively reset the legacy client value.",
      "tradeoffs": [
        "The app behavior is documented honestly.",
        "The setting remains obsolete and stays out of one-click apply."
      ],
      "apply_allowed": false,
      "evidence_ids": [
        "ms-win32-operatingsystem-largesystemcache"
      ]
    },
    {
      "profile_id": "current-app-profile",
      "label": "Current app profile",
      "intended_for": [
        "Systems undoing an old server-style cache tweak",
        "Research comparison only"
      ],
      "avoid_for": [
        "Published validated presets",
        "General users"
      ],
      "states": [
        {
          "target_id": "large-system-cache",
          "state_kind": "value",
          "value": 0,
          "rationale": "Observed app write representing the client/application-focused mode."
        }
      ],
      "good_when": "You want the app to restore the legacy client/applications value 0.",
      "bad_when": "You want a modern, fully supported Microsoft registry control.",
      "tradeoffs": [
        "The historical semantics are captured.",
        "The control remains marked obsolete and unsupported by Microsoft."
      ],
      "apply_allowed": true,
      "evidence_ids": [
        "app-system-registry-provider"
      ]
    }
  ],
  "evidence": [
    {
      "evidence_id": "ms-win32-operatingsystem-largesystemcache",
      "kind": "official-doc",
      "title": "Microsoft Learn: Win32_OperatingSystem LargeSystemCache",
      "location": "https://learn.microsoft.com/en-us/windows/win32/cimwin32prov/win32-operatingsystem",
      "summary": "Microsoft documents the historical 0 and 1 semantics for LargeSystemCache but marks the property obsolete and not supported.",
      "supports": [
        "value",
        "behavior",
        "risk"
      ],
      "strength": "high"
    },
    {
      "evidence_id": "ms-memory-limits-large-system-cache",
      "kind": "official-doc",
      "title": "Microsoft Learn: Memory Limits for Windows Releases",
      "location": "https://learn.microsoft.com/en-us/windows/win32/memory/memory-limits-for-windows-releases",
      "summary": "Microsoft notes that older Windows XP and Windows Server 2003 system-cache limits changed when the LargeSystemCache registry key was set, confirming the key's historical existence but not publishing a modern tuning recommendation.",
      "supports": [
        "behavior",
        "version-scope"
      ],
      "strength": "medium"
    },
    {
      "evidence_id": "app-system-registry-provider",
      "kind": "repo-code",
      "title": "Current app research-surface implementation",
      "location": "Docs/research/app-surface/validated-registry-values.json and app/Services/TweakProviders/ResearchAppSurfaceTweakProvider.cs",
      "summary": "The research app-surface manifest and provider project the record into the app with LargeSystemCache = 0 as the default preset.",
      "supports": [
        "path",
        "value",
        "ui-mapping"
      ],
      "strength": "high"
    }
  ],
  "decision": {
    "confidence": "high",
    "apply_allowed": true,
    "recommended_for_general_users": true,
    "restore_default_supported": true,
    "restore_previous_supported": true,
    "needs_vm_validation": false,
    "why": "Microsoft still publishes the legacy 0/1 semantics, the current app writes only the client reset value 0, and the Win25H2Clean probe confirmed that write is idempotent and reversible. The property stays obsolete, but the current app action is narrow enough to expose as an exact reset-to-client-baseline mapping.",
    "blocking_issues": []
  },
  "last_reviewed_utc": "2026-04-30T20:02:10Z",
  "validation_proof": {
    "source_url": "evidence/files/vm-tooling-staging/vm-batch-probe-20260320.json",
    "exact_quote_or_path": "HKLM\\SYSTEM\\CurrentControlSet\\Control\\Session Manager\\Memory Management\\LargeSystemCache: before=0, after_apply=0, after_restore=0",
    "key_found_on_page": true,
    "notes": "Guest-side reversible probe on Win25H2Clean; see the batch probe output in evidence/files/vm-tooling-staging/vm-batch-probe-20260320.json..md"
  }
}
