{
  "$schema": "../setting-research.schema.json",
  "schema_version": "1.1",
  "record_id": "security.disable-ntfs-encryption",
  "tweak_id": "security.disable-ntfs-encryption",
  "record_status": "validated",
  "summary": "Validated record with machine-checkable proof for the official NTFS encryption policy surface. The app now writes only the documented policy path.",
  "setting": {
    "name": "Disable NTFS Encryption (EFS)",
    "category": "Security",
    "area": "Registry Policy",
    "scope": "device",
    "casual_explanation": "Windows can encrypt files on NTFS volumes by using EFS. This policy decides whether that encryption feature is allowed on NTFS volumes.",
    "why_people_change_it": "People disable it when they want to prevent accidental encrypted files or avoid support issues caused by lost EFS access.",
    "tradeoffs_overview": "Turning it off can simplify file recovery and support, but it also removes a built-in file-encryption option.",
    "professional_notes": "FileSys.admx documents the official policy at HKLM\\System\\CurrentControlSet\\Policies\\NtfsDisableEncryption with enabledValue 1 and disabledValue 0. The app now writes that official value only.",
    "targets": [
      {
        "target_id": "ntfs-disable-encryption-policy",
        "location_kind": "registry",
        "path": "HKLM\\System\\CurrentControlSet\\Policies",
        "value_name": "NtfsDisableEncryption",
        "value_type": "REG_DWORD",
        "allowed_values": [
          {
            "state_kind": "missing",
            "value": null,
            "label": "Not configured",
            "meaning": "Windows does not force the NTFS encryption policy through Group Policy.",
            "evidence_ids": [
              "local-filesys-adml"
            ]
          },
          {
            "state_kind": "value",
            "value": 0,
            "label": "NTFS encryption allowed",
            "meaning": "The policy is disabled and NTFS encryption is not blocked by this policy.",
            "evidence_ids": [
              "local-filesys-admx"
            ]
          },
          {
            "state_kind": "value",
            "value": 1,
            "label": "NTFS encryption disabled",
            "meaning": "Encryption is not allowed on NTFS volumes through the documented policy setting.",
            "evidence_ids": [
              "local-filesys-admx",
              "local-filesys-adml",
              "app-security-provider"
            ]
          }
        ]
      }
    ]
  },
  "app_current_implementation": {
    "status": "matches-research",
    "provider_source": "OpenTraceProject.App/Services/TweakProviders/SecurityTweakProvider.cs",
    "notes": "The current app writes the documented NTFS encryption policy value under System\\CurrentControlSet\\Policies only.",
    "writes": [
      {
        "target_id": "ntfs-disable-encryption-policy",
        "path": "HKLM\\System\\CurrentControlSet\\Policies",
        "value_name": "NtfsDisableEncryption",
        "value_type": "REG_DWORD",
        "state_kind": "value",
        "value": 1
      }
    ]
  },
  "windows_defaults": [
    {
      "label": "Windows policy default",
      "applies_to": "Windows systems supporting the NTFS encryption policy",
      "states": [
        {
          "target_id": "ntfs-disable-encryption-policy",
          "state_kind": "missing",
          "value": null,
          "rationale": "Leave the official NTFS encryption policy unset."
        }
      ],
      "notes": "The local policy text says a reboot is required for this setting to take effect.",
      "evidence_ids": [
        "local-filesys-admx",
        "local-filesys-adml"
      ]
    }
  ],
  "recommended_profiles": [
    {
      "profile_id": "windows-managed-default",
      "label": "Windows managed default",
      "intended_for": [
        "General users",
        "Systems that may still use EFS"
      ],
      "avoid_for": [
        "Machines that explicitly want EFS blocked"
      ],
      "states": [
        {
          "target_id": "ntfs-disable-encryption-policy",
          "state_kind": "missing",
          "value": null,
          "rationale": "Leave the official policy unset until the extra runtime write is resolved."
        }
      ],
      "good_when": "You want to avoid publishing an implementation that mixes a documented policy with an undocumented extra write.",
      "bad_when": "You need a finalized published EFS-off preset immediately.",
      "tradeoffs": [
        "EFS remains under the normal Windows baseline.",
        "The current app write remains documented but not validated."
      ],
      "apply_allowed": false,
      "evidence_ids": [
        "local-filesys-adml"
      ]
    }
  ],
  "evidence": [
    {
      "evidence_id": "local-filesys-admx",
      "kind": "official-doc",
      "title": "Local Microsoft FileSys.admx mapping",
      "location": "C:\\Windows\\PolicyDefinitions\\FileSys.admx",
      "summary": "The local ADMX file maps the NTFS encryption policy to HKLM\\System\\CurrentControlSet\\Policies\\NtfsDisableEncryption with enabledValue 1 and disabledValue 0.",
      "supports": [
        "path",
        "value",
        "allowed-values",
        "version-scope"
      ],
      "strength": "high"
    },
    {
      "evidence_id": "local-filesys-adml",
      "kind": "official-doc",
      "title": "Local Microsoft FileSys.adml help text",
      "location": "C:\\Windows\\PolicyDefinitions\\en-US\\FileSys.adml",
      "summary": "The local ADML help text says enabling the setting prevents access to and creation of encrypted files and requires a reboot to take effect.",
      "supports": [
        "behavior",
        "side-effects"
      ],
      "strength": "high"
    },
    {
      "evidence_id": "app-security-provider",
      "kind": "repo-code",
      "title": "Current app implementation",
      "location": "OpenTraceProject.App/Services/TweakProviders/SecurityTweakProvider.cs",
      "summary": "The provider writes NtfsDisableEncryption = 1 under System\\CurrentControlSet\\Policies.",
      "supports": [
        "path",
        "value",
        "ui-mapping"
      ],
      "strength": "high"
    }
  ],
  "decision": {
    "confidence": "high",
    "apply_allowed": false,
    "recommended_for_general_users": false,
    "restore_default_supported": false,
    "restore_previous_supported": false,
    "needs_vm_validation": false,
    "why": "The official EFS policy surface is now validated and the app writes only the documented policy path. The setting remains high-impact and is not recommended for general users because it disables EFS on NTFS volumes.",
    "blocking_issues": []
  },
  "last_reviewed_utc": "2026-03-20T20:10:00Z",
  "validation_proof": {
    "source_url": "C:\\Windows\\PolicyDefinitions\\FileSys.admx",
    "exact_quote_or_path": "C:\\Windows\\PolicyDefinitions\\FileSys.admx (NtfsDisableEncryption enabledValue=1, disabledValue=0); C:\\Windows\\PolicyDefinitions\\en-US\\FileSys.adml (enabling the setting prevents access to and creation of encrypted files and requires a reboot to take effect).",
    "key_found_on_page": true,
    "notes": "Validated against the local Microsoft policy files for NTFS encryption."
  }
}
