{
  "$schema": "../setting-research.schema.json",
  "schema_version": "1.1",
  "record_id": "privacy.disable-biometrics",
  "tweak_id": "privacy.disable-biometrics",
  "record_status": "validated",
  "summary": "Machine policy for Windows biometrics as a whole. Good for strict privacy or security baselines, but it disables Windows biometric features such as fingerprint and face sign-in on the device.",
  "setting": {
    "name": "Windows Biometrics",
    "category": "Privacy",
    "area": "Registry Policy",
    "scope": "device",
    "casual_explanation": "Windows can use fingerprint, face, or other biometric features for sign-in and related capabilities. This device policy controls whether biometrics are allowed at all.",
    "why_people_change_it": "Some environments disable biometrics for compliance, privacy, or security-policy reasons. Others keep it enabled because biometric sign-in is convenient.",
    "tradeoffs_overview": "Disabling biometrics can satisfy stricter policy requirements, but it removes convenient sign-in methods and related biometric functionality.",
    "professional_notes": "Biometrics.admx maps the top-level device policy to SOFTWARE\\Policies\\Microsoft\\Biometrics\\Enabled with enabledValue 1 and disabledValue 0.",
    "targets": [
      {
        "target_id": "biometrics-enabled",
        "location_kind": "registry",
        "path": "HKLM\\SOFTWARE\\Policies\\Microsoft\\Biometrics",
        "value_name": "Enabled",
        "value_type": "REG_DWORD",
        "allowed_values": [
          {
            "state_kind": "missing",
            "value": null,
            "label": "Not configured",
            "meaning": "The device does not force biometrics on or off through policy.",
            "evidence_ids": [
              "local-biometrics-admx"
            ]
          },
          {
            "state_kind": "value",
            "value": 0,
            "label": "Biometrics disabled",
            "meaning": "Biometric features are disabled by policy.",
            "evidence_ids": [
              "local-biometrics-admx"
            ]
          },
          {
            "state_kind": "value",
            "value": 1,
            "label": "Biometrics enabled",
            "meaning": "Biometric features are explicitly allowed by policy.",
            "evidence_ids": [
              "local-biometrics-admx"
            ]
          }
        ]
      }
    ]
  },
  "app_current_implementation": {
    "status": "matches-research",
    "provider_source": "OpenTraceProject.App/Services/TweakProviders/PrivacyTweakProvider.cs",
    "notes": "The current app writes Enabled = 0 under the Biometrics policy key, which matches the documented disable behavior.",
    "writes": [
      {
        "target_id": "biometrics-enabled",
        "path": "HKLM\\SOFTWARE\\Policies\\Microsoft\\Biometrics",
        "value_name": "Enabled",
        "value_type": "REG_DWORD",
        "state_kind": "value",
        "value": 0
      }
    ]
  },
  "windows_defaults": [
    {
      "label": "Windows device-policy default",
      "applies_to": "Windows 7 and newer systems with biometric policy support",
      "states": [
        {
          "target_id": "biometrics-enabled",
          "state_kind": "missing",
          "value": null,
          "rationale": "The device policy is not configured by default."
        }
      ],
      "notes": "This is the policy baseline, not a statement that every device ships with biometric hardware or user enrollment configured.",
      "evidence_ids": [
        "local-biometrics-admx"
      ]
    }
  ],
  "recommended_profiles": [
    {
      "profile_id": "windows-default",
      "label": "Windows default",
      "intended_for": [
        "General users",
        "Devices where biometric convenience is wanted"
      ],
      "avoid_for": [
        "Environments with a policy against biometrics"
      ],
      "states": [
        {
          "target_id": "biometrics-enabled",
          "state_kind": "missing",
          "value": null,
          "rationale": "Leave the policy unset."
        }
      ],
      "good_when": "You want the device to keep its ordinary biometric policy behavior.",
      "bad_when": "You need a hard disable for biometric features.",
      "tradeoffs": [
        "Biometric features can remain available if the device supports them.",
        "No explicit device-wide policy restriction is enforced."
      ],
      "apply_allowed": true,
      "evidence_ids": [
        "local-biometrics-admx"
      ]
    },
    {
      "profile_id": "no-biometrics",
      "label": "No biometrics",
      "intended_for": [
        "Strict privacy baselines",
        "Compliance-driven environments"
      ],
      "avoid_for": [
        "Users who depend on biometric sign-in convenience"
      ],
      "states": [
        {
          "target_id": "biometrics-enabled",
          "state_kind": "value",
          "value": 0,
          "rationale": "Disable biometric features by policy."
        }
      ],
      "good_when": "You want a clear and enforceable policy against Windows biometrics.",
      "bad_when": "You want fingerprint or face sign-in to remain available.",
      "tradeoffs": [
        "Biometric convenience is removed.",
        "The device follows a stricter policy baseline."
      ],
      "apply_allowed": true,
      "evidence_ids": [
        "local-biometrics-admx",
        "app-privacy-provider"
      ]
    }
  ],
  "evidence": [
    {
      "evidence_id": "local-biometrics-admx",
      "kind": "official-doc",
      "title": "Local Microsoft Biometrics.admx mapping",
      "location": "C:\\WINDOWS\\PolicyDefinitions\\Biometrics.admx",
      "summary": "The local ADMX file defines the biometrics policy and shows Enabled with enabledValue 1 and disabledValue 0 under SOFTWARE\\Policies\\Microsoft\\Biometrics.",
      "supports": [
        "path",
        "value",
        "allowed-values",
        "behavior",
        "version-scope"
      ],
      "strength": "high"
    },
    {
      "evidence_id": "app-privacy-provider",
      "kind": "repo-code",
      "title": "Current app implementation",
      "location": "OpenTraceProject.App/Services/TweakProviders/PrivacyTweakProvider.cs",
      "summary": "The provider writes Enabled = 0 under the Biometrics policy key.",
      "supports": [
        "path",
        "value",
        "ui-mapping"
      ],
      "strength": "high"
    },
    {
      "evidence_id": "repo-provenance-disable-biometrics",
      "kind": "repo-doc",
      "title": "Existing tweak source record",
      "location": "Docs/tweaks/tweak-provenance.json",
      "summary": "The repo already tracks provenance for this tweak in the current catalog output.",
      "supports": [
        "ui-mapping",
        "risk"
      ],
      "strength": "medium"
    }
  ],
  "decision": {
    "confidence": "high",
    "apply_allowed": true,
    "recommended_for_general_users": false,
    "restore_default_supported": true,
    "restore_previous_supported": true,
    "needs_vm_validation": false,
    "why": "Local Microsoft policy files document the exact policy surface, value semantics, and device-wide behavior. The app writes the documented disable value.",
    "blocking_issues": []
  },
  "last_reviewed_utc": "2026-03-12T20:55:44.8915752+03:00",
  "validation_proof": {
    "source_url": "C:\\WINDOWS\\PolicyDefinitions\\Biometrics.admx",
    "exact_quote_or_path": "<policy name=\"Biometrics_EnableBio\" class=\"Machine\" ... key=\"SOFTWARE\\Policies\\Microsoft\\Biometrics\" valueName=\"Enabled\">; Biometrics.adml: If you disable this policy setting, the Windows Biometric Service is unavailable, and users cannot use any biometric feature in Windows.",
    "key_found_on_page": true,
    "notes": "Local official ADMX defines the exact key and value name; local ADML confirms that disabling the policy prevents Windows biometric features from being used."
  }
}
